Subject,Company Name,Founding Year,Current Status,Valuation/Exit Value,Key Success Factor 1,Key Success Factor 2,Key Success Factor 3,Critical Early Decision,Product-Market Fit Strategy,Revenue Strategy,Team/Culture Factor,Funding Efficiency,Mistake Avoided/Recovered,Lesson for SMEs,Error
Copy.ai (AI Content),Copy.ai (AI Content),2020,Acquired,$17M,Pivoted from a copywriting tool to a comprehensive GTM (Go-to-Market) AI platform.,Strong product-led growth (PLG) strategy that attracted millions of individual users.,Effective 'Land and Expand' sales model with targeted 'wedge' packages for enterprise clients.,Launched 5 MVPs in 90 days to rapidly test ideas and find a product that resonated with the market.,"Addressed the strategic pain point of 'Go-to-Market Bloat' for C-level executives, creating a new category.",Adopted a consumption-based pricing model to reduce friction and encourage widespread adoption.,A strong founder-led vision focused on recruiting a high-caliber team to execute an ambitious roadmap.,Raised $16.9M to acquire over 17 million users before its acquisition by Fullcast.,Avoided competing in the crowded AI writing assistant market by moving upmarket to enterprise sales.,Continuously evolve your product to solve higher-value problems for a more lucrative customer segment.,
Descript (Audio/Video),Descript (Audio/Video),2017,Private Unicorn,$550M,"Novel text-based video editing, making it as easy as editing a doc.","AI-powered features like transcription, overdub, and automatic editing.","Strong focus on the creator economy, empowering podcasters and YouTubers.","Pivoting from an audio tour guide app to a generalized audio/video editor, broadening their market.",Targeting podcasters and video creators with a tool that dramatically simplifies their workflow.,Freemium SaaS model with tiered subscriptions for individuals and teams.,"Led by experienced founder Andrew Mason, with a strong product and engineering culture.","Raised $100M, including a $50M Series C led by OpenAI, to accelerate AI-powered features.",Avoiding the hyper-growth mistakes of Groupon by focusing on sustainable product-led growth.,Solve a painful problem for a niche audience with a radically simpler solution.,
Runway (AI Video),Runway (AI Video),2018,Private Unicorn,$3B,"Democratizing AI through an intuitive, user-friendly interface, making complex technology accessible.",Product-led growth driven by the viral nature of its impressive AI-generated content.,"Building a strong community through creative challenges and film festivals, turning users into evangelists.","Focused on the art and film communities first, building a passionate, early-adopter user base that provided high-quality feedback.","Targeted a niche of creative professionals who had a strong need for the product, and then expanded to the broader market.","Subscription-based model with tiered pricing for individuals, teams, and enterprises.","A culture that merges art and science, with a team that has a shared background in technology and arts.",Strategic funding from investors who understood the long-term vision of owning foundational AI models.,Avoided building a powerful technology without a focus on user experience and accessibility.,The user interface is as important as the technology. Turn complexity into simplicity to achieve mass adoption and a competitive advantage.,
Midjourney (AI Art),Midjourney (AI Art),2022,Private,$10B,Fostering a collaborative community on Discord for co-creation and learning.,Relentless focus on improving image quality and model capabilities.,"Bootstrapped and profitable early, allowing for independent and focused growth.","Launching as a Discord bot to build a strong, interactive user community from day one.",Tapping into the creative needs of a large user base with a powerful yet accessible tool on Discord.,"Simple subscription-based model with tiered pricing, providing predictable revenue.","Small, focused, and highly effective team of engineers and researchers.","Self-funded and profitable, avoiding VC pressure and retaining full control.","Avoiding dependence on venture capital, which allowed for a focus on product over growth.",Build a strong community around your product to foster organic growth and user engagement.,
OpenAI (AI Research),OpenAI (AI Research),2015,Private Unicorn,$500B,First-mover advantage with ChatGPT's public release.,Iterative development and rapid experimentation.,Strategic partnership with Microsoft for funding and resources.,Transitioned from non-profit to a 'capped-profit' structure to attract investment and talent.,"Freemium model for ChatGPT and an API-first platform for developers, fostering viral growth and a strong ecosystem.","Tiered subscriptions, usage-based API pricing, and enterprise solutions.",Mission-oriented culture focused on building safe and beneficial AGI.,Strategic partnership with Microsoft and high-valuation venture funding.,Recovered from a leadership crisis by restructuring the board and reaffirming its mission.,A strong mission attracts talent and resources; iterate quickly and leverage user feedback to find product-market fit.,
Anthropic (AI Safety),Anthropic (AI Safety),2021,Private Unicorn,$350B,"Focus on AI safety and constitutional AI, differentiating from competitors.",Strong founding team of former OpenAI researchers with deep expertise in AI.,"Strategic partnerships with major cloud providers (AWS, Google Cloud) for distribution.","Founders left OpenAI to create a company with a strong focus on AI safety and responsible AI development, which attracted talent and investors.",Developed a family of powerful and safe language models (Claude) that cater to the growing enterprise demand for reliable and steerable AI.,B2B focus on enterprise clients and partnerships with major cloud providers to monetize their AI models.,A research-heavy culture focused on long-term AI safety and benefit to humanity.,"Secured massive strategic investments from Amazon and Google, enabling rapid scaling and research.","Avoided a premature public release of their first model, prioritizing internal safety testing and responsible development.","A strong, mission-driven focus on a critical niche can attract significant talent, funding, and strategic partnerships, even in a competitive market.",
Cohere (Enterprise AI),Cohere (Enterprise AI),2019,Private Unicorn,$7B,"Enterprise-first focus, providing secure and private AI solutions for businesses.","Strategic partnerships with major tech companies like Oracle, Salesforce, and Google.","Strong founding team with deep AI expertise, including a co-author of the Transformer paper.","Focused on enterprise needs from the start, providing secure, private AI solutions instead of competing with consumer-facing models.","Offered customizable, secure LLMs deployable on-premises or cloud, addressing enterprise data privacy and security concerns.","Subscription-based model with flexible pricing, API integrations, and a free trial to drive adoption.","Research-driven culture with a non-profit lab (Cohere Labs) for open-source AI research, attracting top talent.","Raised significant capital from top investors, enabling rapid scaling, global expansion, and R&D.","Avoided the 'bigger is better' model race, focusing on smaller, efficient models for specific enterprise use cases.","Focus on a specific niche, solve a real problem for a well-defined customer segment, and build a team with deep domain expertise.",
Hugging Face (ML Platform),Hugging Face (ML Platform),2016,Private Unicorn,$4.5B,A thriving open-source community and a central model hub for sharing and collaboration.,"A strong focus on developer experience, making complex machine learning models easy to use.",Building a strong network effect through community engagement and user-generated content.,Pivoting from a chatbot app for teenagers to an open-source platform for machine learning models.,"Providing pre-trained models and tools (Transformers library) that solved a major pain point for ML developers, making advanced NLP accessible.","A freemium model with paid tiers for enterprise features, support, and private hosting.",A mission-driven culture focused on democratizing machine learning for everyone.,Strategic funding from major tech companies like Salesforce and Nvidia to fuel growth.,"Avoiding a closed, proprietary model and embracing open-source from the beginning.",Build a strong community around your product and leverage open-source to drive adoption and innovation.,
Scale AI (Data Labeling),Scale AI (Data Labeling),2016,Private Unicorn,$14B,Early focus on high-value niches like autonomous vehicles and government contracts.,Human-in-the-loop' model combining AI with a large human workforce for high-quality data.,"Strong brand positioning as essential AI infrastructure, attracting top-tier clients and investors.","Pivoting from a general data labeling service to a full-stack AI data platform, addressing the entire ML lifecycle.","Achieved PMF by providing high-quality data for critical applications like self-driving cars, then expanding to serve the broader AI market, including generative AI.","B2B model with a mix of pay-per-task, platform subscriptions, and large enterprise/government contracts.",High-talent density with a focus on hiring individuals with an internal locus of control.,"Strategic fundraising from top-tier investors, leveraging brand to secure large rounds at high valuations.","Avoiding being a niche player by expanding from data labeling to a full-stack platform, thus capturing more value.","Focus on building a strong brand and positioning as a critical partner, not just a vendor, to attract high-value customers and talent.",
Weights & Biases (ML Ops),Weights & Biases (ML Ops),2017,Acquired,$1.7B,"Developer-first approach, focusing on building tools that ML practitioners love to use.","Iterative product development, driven by user feedback and a willingness to pivot and refine the product.","Comprehensive platform that addresses the entire MLOps workflow, from experiment tracking to model deployment.","Partnered with OpenAI and Toyota as early design partners to iterate on the product based on their feedback, focusing on solving specific pain points.","Started by solving a niche problem (sharing TensorBoard visualizations), then iterated with a small user base to refine the product and user experience.","Freemium model with a focus on product-led growth, converting individual users into paying enterprise customers.",Engineering-style culture with a focus on demo-driven development and rapid iteration.,"Raised $250M in total funding before being acquired, indicating strong investor confidence and capital availability for growth.","Avoided building a broad, unfocused platform from the start, instead focusing on a niche pain point (experiment tracking) and expanding from there.",Focus on a specific user pain point and iterate relentlessly based on feedback from early design partners. A great product experience is key to bottoms-up adoption.,
Vercel (Frontend Cloud),Vercel (Frontend Cloud),2015,Private Unicorn,$9.3B,Developer-obsessed approach with a relentless focus on simplicity and developer experience (DX).,"Successful open-source strategy with Next.js, creating a massive and loyal developer community.","Pioneering the 'Frontend Cloud' category, establishing themselves as a first-mover and leader.",Focusing on open-source (Next.js) to build a large developer community and drive bottom-up adoption.,Achieved extreme product-market fit by simplifying the complexities of frontend development and deployment.,"Freemium model for their hosting platform, with enterprise plans for advanced features and support.","A culture of continuous learning and experimentation, deeply rooted in open-source principles.","Strategic funding rounds to accelerate growth, culminating in a $300M Series F.",Avoiding the 'build it and they will come' fallacy by prioritizing community and developer advocacy.,Build a strong community around your product by focusing on solving a real problem for a niche audience.,
Supabase (Backend Platform),Supabase (Backend Platform),2020,Private,$5B,Open-Source & PostgreSQL-based BaaS,Developer-centric approach and strong community,Freemium model with scalable paid tiers,"Positioned as an open-source Firebase alternative, fostering community and developer trust from day one.","Addressed developer need for a scalable, open-source BaaS, validated by a viral Hacker News launch.","Freemium model with tiered pricing (Pro, Team, Enterprise) that scales with usage.","Hiring heavily from their open-source community, ensuring a passionate and knowledgeable team.","Raised significant capital quickly, showing strong market traction and investor confidence.","Avoided vendor lock-in by being open-source, a key advantage over proprietary platforms like Firebase.","Leverage open-source and community-led growth to drive adoption, gather feedback, and build a loyal user base.",
PlanetScale (Database),PlanetScale (Database),2018,Private,$1B,Developer-centric workflow with Git-like branching for safe schema migrations.,"Serverless architecture that automates scaling, sharding, and management.",Leveraging the power and credibility of the open-source Vitess project.,"Built on Vitess, an open-source database clustering system from YouTube, to provide proven scalability from day one.","Targeted developers with a freemium model and a focus on ease of use, abstracting away the complexities of database scaling and management.","Usage-based SaaS model where customers pay for storage, compute, and data transfer.",Emphasis on a remote-first culture and attracting top talent from major tech companies.,"Aggressive funding to capture the market, raising over $185M to fuel growth and product development.","Avoided building a generic database; instead, focused on the niche of MySQL-compatible, serverless databases.","Focus on solving a difficult, specific problem for a technical audience. A strong open-source foundation can build trust and accelerate adoption.",
Neon (Serverless Postgres),Neon (Developer Platform),2021,Acquired,$1B,"Serverless architecture that separates storage and compute, enabling autoscaling and cost-efficiency.",Focus on developer experience with features like instant database branching for CI/CD workflows.,Strategic bet on Postgres becoming the dominant operational database for developers.,"Building an open-source, serverless Postgres platform inspired by AWS Aurora's separation of storage and compute, to capitalize on the growing dominance of Postgres.","Targeted developers with a freemium model, offering a database that fits modern, fast-paced development cycles with features like preview branches for every pull request.","A product-led growth model with a free tier to drive adoption, and paid tiers for advanced features and resources.",A strong engineering culture that prioritizes reliability and performance as table stakes for a database company.,"Raised over $100M to support rapid growth and infrastructure, running 700,000 databases.",Managed hyper-growth reliability issues by transparently addressing postmortems and prioritizing stability over new features when necessary.,Align with a dominant open-source trend and differentiate by building a superior developer experience that integrates seamlessly into modern workflows.,
Railway (Cloud Platform),Railway (Cloud Platform),2020,Private,$24M,"Developer-centric approach, simplifying deployment and removing infrastructure-related friction.","Ease of use and intuitive design, allowing for rapid application deployment without deep expertise.","Focus on speed and efficiency, enabling developers to ship software up to 10x faster.","Focused on solving the critical pain point of complex and time-consuming application deployment, which resonated with a large developer audience.",Addressed a significant pain point for a large market and continuously iterated the product based on user feedback to meet evolving needs.,Usage-based pricing model to attract developers and a growing focus on enterprise customers.,"Remote-first team with a strong engineering culture, led by experienced engineers.","Strategic investors with deep industry experience, including Vercel CEO and GitHub co-founder.",Avoided vendor lock-in by designing a platform-agnostic solution.,"Focus on solving a real problem for a specific audience, build a strong community around your product, and continuously iterate based on user feedback.",
Render (Cloud Hosting),Render (Cloud Hosting),2018,Private,$257M,"Simplified and unified platform for developers, reducing the complexity of cloud infrastructure management.","Strong focus on developer experience, making it easy and fast to deploy and scale applications.","Founder's experience at Stripe, which provided valuable insights into building a successful startup.","Focusing on a simplified developer experience to abstract away the complexities of cloud infrastructure, inspired by the founder's experience at Stripe.","Targeted developers frustrated with the complexity of major cloud providers, offering a more intuitive and productive alternative for building and scaling applications.","A usage-based pricing model where customers pay for the resources they consume, allowing for scalability.","A culture of engineering excellence and user empathy, driven by a team of experienced and talented individuals.",Raised significant venture capital across multiple rounds to accelerate product development and market reach.,"Avoiding the trap of building a feature-heavy platform, instead focusing on a streamlined and intuitive user experience from the start.","Identify a clear pain point for a specific audience and build a product that provides a simple, elegant solution. Founder experience can be a significant asset.",
Fly.io (Edge Computing),Fly.io (Edge Computing),2017,Private,$467M,Developer-centric platform with a powerful CLI (flyctl) that simplifies deployment and management.,Global edge network offering low-latency application delivery by running apps close to users.,"Use of Firecracker microVMs for fast, secure, and isolated application environments.","Focused on simplifying global app deployment for developers, a major pain point, rather than competing broadly with cloud giants.","Offered a simple, powerful platform for a clear developer need: easy global app deployment. A generous free tier and pay-as-you-go pricing accelerated adoption.","Usage-based pricing for compute, storage, and bandwidth, with premium support options for enterprise clients.","Experienced founding team with deep infrastructure expertise, fostering a culture of technical excellence.",Raised over $110M from top VCs like A16Z and Intel Capital to fuel growth and infrastructure expansion.,Avoided direct competition with cloud giants by focusing on the underserved niche of edge computing for developers.,"Identify a niche with a significant pain point and build a superior, focused solution instead of competing head-on with market leaders.",
Retool (Internal Tools),Retool (Internal Tools),2017,Private Unicorn,$3.2B,Solved the painful and universal problem of building custom internal tools for developers.,Intense focus on a specific ICP: frontend and backend developers using React or JavaScript.,"Developer-centric, product-led growth strategy that resonated with the target audience.",Pivoted from targeting FileMaker developers to focusing on frontend and backend developers who dislike building internal tools.,"Achieved PMF through intense customer obsession and rapid iteration, aiming for '100 happy customers' before scaling.",Subscription-based pricing tiers with a focus on enterprise customers and high-value contracts.,An engineering-driven culture focused on solving real-world customer problems and shipping products fast.,"Raised $141M to fuel growth, achieving strong unit economics with a focus on enterprise sales.",Avoided the 'build it and they will come' fallacy by actively seeking and iterating on customer feedback.,Obsess over achieving deep product-market fit with a small group of initial customers before attempting to scale.,
Webflow (No-Code Web),Webflow (No-Code Web),2013,Private Unicorn,$4B,"Empowering designers with a visual-first platform, bridging the gap between design and development.","Strong community focus, with active forums and support from the founders in the early days.","Gradual, feature-by-feature product development, launching early and iterating based on user feedback.","Focused on a small, passionate user base to ensure their success, rather than trying to appeal to everyone at once.","Building a product that solved a real pain point for web designers, allowing them to build responsive websites visually without writing code.","Subscription-based SaaS model with tiered pricing for different user needs, from freelancers to enterprises.","A culture of transparency and community, with the founders actively involved in supporting users.","Bootstrapped for a significant period, focusing on profitability and sustainable growth before raising large funding rounds.","Avoiding the temptation to build all features at once, instead launching a limited but functional product and iterating.",Focus on a niche audience and build a product that solves a deep pain point for them. Engage with your community and build a loyal following.,
Bubble (No-Code Apps),Bubble (No-Code Apps),2012,Private,$1B,Empowering non-technical founders to build web apps without code.,A powerful and flexible visual programming editor.,A strong community and ecosystem of plugins and templates.,"Bootstrapped for years, focusing on product and sustainability before taking significant VC funding, which allowed them to maintain their vision.","Gained early traction through word-of-mouth and a successful Product Hunt launch, validating the need for a no-code platform.","SaaS model with tiered pricing from free to enterprise, plus a marketplace for templates and plugins.","A strong, founder-led vision with a focus on empowering users.","Raised a massive $100M Series A after years of bootstrapping, indicating strong traction and user base.","Resisted investor pressure to specialize in a niche, instead building a horizontal platform.",Focus on building a product that solves a real problem and achieving sustainability before seeking large-scale funding.,
Zapier (Automation),Zapier (Automation),2011,Private Unicorn,$5B,"Extensive library of 7,000+ app integrations, creating a strong network effect.",Freemium model and strong content marketing to attract a wide user base.,"Focus on ease of use for non-technical users, democratizing automation.","Started as a side project and launched with Y Combinator, focusing on a niche problem.",Achieved PMF by enabling non-technical users to connect web applications without any code.,Subscription-based model with tiered pricing based on usage and features.,"Pioneered a remote-first culture, emphasizing trust, autonomy, and asynchronous work.","Highly capital-efficient, reaching a $5B valuation with only $1.4M in funding.",Avoided the typical Silicon Valley model of raising massive funding rounds.,"Focus on solving a specific, painful problem for a niche audience and build a sustainable business.",
Make (Workflow Automation),Make (Workflow Automation),2012,Acquired,Acquired by Celonis (valued at $13B),"Product-led growth (PLG) with a focus on a superior product experience and a powerful, flexible platform.","Generous free plan that allows users to experience the full power of the product, winning over competitors.","A culture of innovation and deliberate, calm decision-making, prioritizing sustainable growth over hypergrowth.","Bootstrapped and focused on building a product 10x better than competitors, even with a steeper learning curve, before seeking widespread adoption.","Built a tool to 'scratch their own itch' based on their experience as systems integrators, ensuring the product solved real-world problems.",Freemium model with a generous free plan to attract a large user base and convert them to paid plans.,"A culture of innovation, contribution, and ownership, with a focus on calm and deliberate decision-making.","Bootstrapped to $10M in revenue before being acquired by Celonis, demonstrating high capital efficiency.","Avoided the 'grow at all costs' mentality, which allowed for a focus on building a sustainable business.",Focus on building a superior product that solves a real problem. A generous freemium model can be a powerful customer acquisition tool.,
n8n (Workflow Automation),n8n (Workflow Automation),2019,Private,$2.5B,"Pioneered a 'fair code' model, fostering a strong and active developer community.","Successfully pivoted to an AI-powered platform, enabling natural language workflow creation.","Low-code/no-code approach, simplifying workflow automation for developers.","Adopted a 'fair code' model, a progression of open source, to build a strong developer community.","Targeted developers with a low-code tool, then expanded to AI-powered workflows, leading to 5x revenue growth.",Freemium model with paid enterprise plans for larger customers.,Community-driven culture with a large and active contributor base on GitHub.,"Raised $240M in total, achieving a $2.5B valuation, indicating strong investor confidence.",Overcame low initial adoption of their AI features by persevering until the market was ready.,A strong community and embracing new technologies like AI can drive exponential growth.,
