Subject,Company Name,Founding Year,Current Status,Valuation/Exit Value,Key Success Factor 1,Key Success Factor 2,Key Success Factor 3,Critical Early Decision,Product-Market Fit Strategy,Revenue Strategy,Team/Culture Factor,Funding Efficiency,Mistake Avoided/Recovered,Lesson for SMEs,Error
Tray.io (Integration Platform),Tray.io (Integration Platform),2012,Private Unicorn,$600M,General automation platform with a graphical interface for non-technical users.,Focus on enterprise customers and offering a white-label embedded solution.,Capitalizing on the API economy with a strong focus on integrations.,Relocating to San Francisco from the UK to access a better funding environment.,"Started with simple email-centric integrations and expanded to ~400 apps, driven by customer demand.","No free tier, with paid packages starting at $595/month.","Bootstrapped in the early days, fostering a culture of resilience and resourcefulness.","Raised significant funding rounds in quick succession, capitalizing on market momentum.",Avoided unfavorable funding terms in the UK by relocating to the US.,Don't be afraid to relocate to a more favorable market for fundraising and growth.,
Plaid (Financial Data),Plaid (Fintech),2013,Private Unicorn,$13.4B,"Developer-first approach with a simple, powerful API that solved a major pain point for fintechs.","Became the essential infrastructure (the ""plumbing"") for the booming fintech industry.",Strategic acquisition of Quovo to expand data aggregation capabilities and market reach.,"Pivoted from a consumer-facing financial management app to a B2B API-first company, addressing a critical need for fintech developers.","Provided the critical link between financial institutions and consumer-facing fintech apps, enabling innovation.","Usage-based pricing model, aligning Plaid's success with the growth of its developer customers.",A mission-driven culture focused on democratizing financial services through technology.,"Raised significant capital from top-tier investors, enabling rapid growth and strategic acquisitions.","Successfully navigated the failed Visa acquisition, turning it into a catalyst for a larger funding round.",Focus on solving a core infrastructure problem for a growing industry and build a strong developer ecosystem.,
Marqeta (Card Issuing),Marqeta (Fintech),2010,Public (IPO),$2.05B,First-mover advantage as a modern card issuing platform with an open API.,"Just-in-Time (JIT) funding, which reduces the need for pre-funding and minimizes fraud risk.","Partnerships with major players like Visa, enabling global scale and reach.","Focused on building an open API platform for card issuing, allowing developers to create customized payment solutions, which was a novel approach in 2014.","Initially targeted tech-savvy startups and on-demand services that needed flexible and scalable payment solutions, then expanded to other verticals.","Interchange fees from card transactions, with a model that gives them a larger share of the fee compared to competitors.","Resilience and a willingness to pivot, as demonstrated by the founder's early struggles and the company's evolution.","Raised $528M over 9 rounds before its IPO, indicating strong investor confidence and a well-managed funding strategy.","Avoided relying on traditional banking infrastructure, instead building its own modern platform from the ground up.",Focus on a specific niche and build a platform that empowers developers. This can lead to rapid innovation and adoption by a wide range of businesses.,
Brex (Corporate Cards),Brex (Fintech),2017,Private Unicorn,$12.3B,Targeted a niche market of startups and high-growth companies with tailored financial products.,Offered higher credit limits and rewards specifically designed for the needs of founders and their businesses.,"Built a strong brand and community through targeted marketing, events, and a founder-focused message.","Pivoted from a VR startup to a fintech company within the Y Combinator program, recognizing a more significant market opportunity.",Addressed a major pain point for founders who struggled to obtain corporate credit cards by creating a product specifically for their unique financial profiles.,Evolved from a model based on interchange fees to a subscription-based SaaS model with a suite of financial software and services.,"Cultivated a ""founder mentality"" culture, empowering employees to take ownership and solve problems creatively.",Raised over $1.2B from top-tier investors to fuel rapid growth and product development.,Successfully pivoted away from their initial VR startup idea to address a more pressing market need.,"Focus on solving a specific, painful problem for a well-defined niche audience to build a loyal customer base and gain initial traction.",
Ramp (Expense Management),Ramp (Fintech),2019,Private Unicorn,$32B,"Focus on customer savings and efficiency, helping businesses spend less.",Strong founding team with prior success (Paribus acquired by Capital One).,Product-led growth with a freemium model and a high-value corporate card.,Interviewed 100 finance experts to deeply understand customer pain points around expense management.,"Started with a simple, high-value corporate card and expanded into a full spend management platform.",Interchange fees from card transactions and SaaS subscriptions for premium features.,"Hired former founders and top talent, fostering a culture of speed and ownership.","Raised significant funding at increasing valuations, enabling rapid scaling.",Avoided being a single-point solution by building a comprehensive expense management platform.,Solve a deep customer pain point by offering a clear value proposition of saving both time and money.,
Mercury (Banking),Mercury (Fintech),2017,Private Unicorn,$3.5B,"Niche focus on startups and tech companies, offering tailored services.","Superior user experience and product design, simplifying business banking.",Building a strong community and brand through content and events.,"Partnering with community banks to offer FDIC-insured accounts, which built trust and credibility.","Solved the pain points of traditional business banking for startups, such as slow onboarding and clunky interfaces.","Interchange fees from card swipes, interest on deposits, and value-added services like Treasury.",Strong engineering-driven culture focused on customer feedback and rapid product iteration.,"Raised $452M in total, with a significant $300M Series C, showing strong investor confidence.",Successfully navigated the SVB collapse by quickly reassuring customers and diversifying partner banks.,"Focus on a specific niche and build a product that solves their unique problems, rather than trying to be everything to everyone.",
Carta (Equity Management),Carta (Equity Management),2012,Private Unicorn,$2B,"First-mover advantage in digitizing equity management, replacing spreadsheets and expensive legal counsel.","Strong network effects, with the platform's value growing as more companies and investors join.",Successful product expansion from cap table management to a full suite of equity-related services.,"Focused on the niche, critical pain point of cap table management for startups, gaining a strong market foothold.","Offered a free 'Launch' tier to attract early-stage startups, then upsold to paid plans as they grew.",Tiered SaaS subscription model with pricing based on company size and required features.,"A culture of ownership, problem-solving, and internal leadership development.","Raised $1.2B in venture capital to fuel aggressive growth, product development, and market leadership.",Rebranded from eShares to Carta to reflect a broader vision and recovered from a data privacy scandal.,"Solve a significant, unsexy problem for a niche market, then expand offerings to grow with your customers.",
Gusto (Payroll),Gusto (Payroll),2012,Private Unicorn,$9.5B,Customer-centric approach with a strong emphasis on user feedback and empathy.,"Simple, all-in-one platform for payroll, benefits, and HR, reducing complexity for SMBs.","Strategic, state-by-state rollout ensuring compliance and service quality.","Focused on payroll as the core, non-discretionary service for small businesses, then expanded to a full HR platform.","Addressed the underserved SMB market with an easy-to-use, integrated HR and payroll solution, leading to high NPS.","Subscription-based SaaS model, providing predictable recurring revenue.","Strong, values-driven culture focused on mentorship, collaboration, and customer obsession.","Raised over $700M, enabling strategic growth and product expansion while maintaining a high valuation.","Avoided a rapid, nationwide launch, opting for a deliberate, state-by-state expansion.","Solve a core, painful problem for a niche market first, then expand your offerings based on customer needs.",
Rippling (HR Platform),Rippling (HR Platform),2016,Private Unicorn,$13.5B,"Compound Startup model: offering a unified platform for HR, IT, and Finance.",Strong focus on product-led growth and cross-selling opportunities.,Hiring former founders as product managers to drive innovation and new product lines.,"Building a single source of truth for employee data, expanding beyond HR to create a comprehensive workforce management platform.","Started with a core offering of payroll and benefits, then expanded into a full suite of integrated products, creating a 'magic button' experience.","Subscription-based model with a monthly fee per employee, encouraging adoption of multiple products.","A culture of extreme customer focus, exemplified by the 'Go to Western Union' story.","Secured a large Series A, enabling rapid product development and market expansion.",Learned from the founder's previous venture (Zenefits) to build a more robust and compliant platform from the ground up.,A unified platform for employee data can lead to significant efficiency gains and better decision-making across the entire organization.,
Deel (Global Payroll),Deel (Global Payroll),2019,Private Unicorn,$17.3B,"Vertical integration of the full payroll stack, ensuring speed, control, and accuracy.","Modular, unbundled services that allow customers to solve specific HR problems without a full overhaul.",Aggressive M&A strategy to quickly acquire new technologies and market presence.,"Focused on remote, global teams before the pandemic, which positioned them perfectly for the shift to remote work.",Started with a contractor payment platform and expanded to EOR services based on strong customer demand.,"Land-and-expand model, upselling customers from a single service to a full suite of HR products.","A culture of extreme speed and execution, enabling rapid international expansion and product development.",Raised significant capital from top-tier VCs to fuel aggressive growth and strategic acquisitions.,"Avoided relying on a patchwork of third-party vendors, which prevented quality and speed issues.","Solve a specific, painful problem for a niche market, then expand offerings based on customer needs.",
Remote (Global HR),Remote (Global HR),2019,Private Unicorn,$3B,"A wholly-owned EOR model, providing full control over compliance and service quality.","Perfect timing, launching just before the massive global shift to remote work due to the pandemic.",Strong focus on legal and compliance infrastructure from the very beginning.,Building a fully distributed team from day one to deeply understand and solve the challenges of remote work.,"Offered a simple, flat-fee solution for the complex problem of international hiring, payroll, and compliance.","A transparent, SaaS-based flat-fee subscription model for its EOR and contractor management services.","A fully remote and asynchronous work culture, attracting top global talent and 'eating their own dog food'.",Aggressively raised over $500M in funding to rapidly scale its global infrastructure and services.,"Avoiding the 'aggregator' EOR model, which relies on third-party partners and can lead to inconsistent service.","Identify a significant, emerging pain point and build a comprehensive, scalable solution to address it.",
Oyster (Distributed HR),Oyster (Distributed HR),2020,Private Unicorn,$1.2B,Mission-driven approach to democratize global hiring and reduce inequality.,"Solved a critical pain point for companies wanting to hire global talent, accelerated by the pandemic.",Strong focus on content marketing and category creation to educate the market.,Pivoted to a partner-based model to quickly scale their employment infrastructure when setting up entities was difficult during the pandemic.,"Launched with an MVP and iterated based on feedback from early design partners, capitalizing on the massive shift to remote work.","Transparent, cost-competitive pricing for their Employer of Record (EOR) services.","A fully distributed, remote-first company culture that practices what it preaches.","Raised significant funding rounds in a short period, reaching a unicorn valuation in about two years.",Avoided trying to build everything in-house from the start by acquiring a company with an existing partner network.,"A strong mission-aligned business model can attract both customers and investors, and content marketing can be a powerful growth engine.",
Lattice (Performance Management),Lattice (Performance Management),2015,Private Unicorn,$3B,Exceptional content marketing that drives significant organic traffic and establishes brand authority.,Capitalized on the shift to remote work during the COVID-19 pandemic.,A product-led growth strategy focused on user needs and a 'people-first' platform.,"Focused on building a strong brand and content marketing strategy from the early days, creating a library of resources for HR professionals.","Addressed the growing need for performance management and employee engagement tools for remote and hybrid teams, a need that accelerated during the pandemic.","SaaS subscription model targeting enterprise customers, leading to a significant growth in ARR.","Emphasizes a 'people-first' culture, which is reflected in their product and marketing.","Raised nearly $330M in total funding, including a $175M Series F round, to fuel growth.",Avoided the common startup mistake of neglecting brand building and content marketing in the early stages.,"Invest in high-quality content marketing to build a strong brand and drive long-term organic growth, even in a crowded market.",
Culture Amp (Employee Experience),Culture Amp (Employee Experience),2009,Private Unicorn,$2.2B,"Product-centric approach with a focus on user experience, making the platform 'loved' by customers.","Targeted 'culture-first' companies, attracting fast-growing tech and service organizations.","Provided real-time, benchmarked data for data-driven insights into company culture.","Bootstrapped to $1M ARR before raising Series A, pitching VCs for customers, not cash, to avoid early dilution and gain traction.","Capitalized on the post-GFC shift to data-driven HR with a user-friendly, real-time employee feedback and analytics platform.",Subscription-based SaaS model providing a recurring revenue stream.,A founding team with a blend of engineering and organizational psychology expertise.,"Bootstrapped to $1M ARR, then strategic funding rounds for global expansion.","Avoided a 'features-first' product, focusing instead on user experience and solving a real problem.",Focus on solving a real customer pain point with a product people love. Bootstrap to retain equity and gain traction before seeking funding.,
15Five (Performance),15Five (Performance),2011,Private,$52M,"Human-centered approach to performance management, focusing on employee growth and well-being.",Emphasis on manager effectiveness through a combination of software tools and coaching.,Strong company culture based on positive psychology and the concept of 'Best-Self Management'.,"Focusing on a weekly check-in format (15 minutes for employees, 5 for managers) to improve communication and feedback loops.","Identified a need for simple, consistent communication between managers and employees, leading to the core 15Five weekly check-in product.",SaaS model with tiered pricing plans based on features and number of users.,"Emphasis on positive psychology and employee growth, with a 'Best-Self Management' philosophy.",Raised significant funding across multiple rounds to fuel growth and product development.,"Avoided building a complex, feature-heavy platform initially, instead focusing on a simple, effective solution.",A strong focus on employee well-being and development can be a key differentiator and driver of business success.,
Gong (Revenue Intelligence),Gong (Revenue Intelligence),2015,Private Unicorn,$7.25B,"Created the 'Revenue Intelligence' category, defining a new market instead of competing in an existing one.","Used content marketing (Gong Labs) to educate the market about the problem, not just the product.","Provided data-driven insights to sales teams, replacing opinions with reality.","Solving a personal pain point of the founder, who experienced a sudden drop in sales pipeline.",Focused on a critical pain point for sales leaders: lack of visibility into sales conversations and deals.,"Enterprise subscription-based SaaS model, ensuring recurring revenue and high customer lifetime value.",A strong culture of 'winning as a team' and creating 'raving fans' out of customers.,Strategic fundraising focused on growth and attracting ideal customer profiles.,"Avoided building a solution in search of a problem by focusing on a well-defined, painful business need.",Educate your market on the problem you solve to build trust and create demand for your solution.,
Chorus.ai (Conversation Intelligence),Chorus.ai (Conversation Intelligence),2015,Acquired,$575M,Pioneering AI in Sales: first-mover in AI-driven conversation analysis for sales.,Data-Driven Coaching: platform offered data-backed recommendations for sales reps.,"Strong Revenue Growth: impressive revenue growth, reaching $55M in 2020.","Focused on the untapped potential of conversation data, recognizing its value for businesses.","Achieved through relentless iteration, embracing early negative feedback to improve the product.","SaaS subscription model with per-user pricing, providing a predictable and scalable revenue stream.","A culture of perseverance and resilience, weathering early challenges to stay focused on their vision.","Raised $100.3M in funding to fuel growth and product development, showing investor confidence.","Avoided giving up in the face of early setbacks, using negative feedback for improvement.",Perseverance and a customer-centric approach are key. Listen to feedback and iterate to succeed.,
Clari (Revenue Platform),Clari (Revenue Platform),2013,Private Unicorn,$2.6B,Unified revenue platform providing a single source of truth for all revenue-critical employees.,AI-powered predictions for accurate revenue forecasting and pipeline management.,"Initial focus on the 'golden triangle' of rep, manager, and exec to solve collaboration pain points.","Pivoted from selling to individual sales reps to a top-down enterprise sales motion targeting sales leaders, which proved to be a more effective GTM strategy.","Addressed the pain of inaccurate revenue forecasting by replacing the 'three-headed hydra' (CRM, Excel, BI) with a single, integrated platform.",SaaS subscription model with customized pricing for a suite of products and modules.,"Experienced founding team with deep expertise in enterprise software, AI, and machine learning.","Raised $510M over 7 rounds, with a Series F round that quadrupled the company's valuation to $2.6B.",Avoided building a point solution by creating a platform that addresses the needs of multiple stakeholders.,Focus on solving a critical pain point for a specific customer segment and be prepared to pivot your GTM strategy based on market feedback.,
Outreach (Sales Engagement),Outreach (Sales Engagement),2014,Private Unicorn,$4.4B,"A relentless focus on solving customer pain points, which guided their successful pivot and product development.","A strong, commission-based sales team that was highly motivated to sell the product.",A culture of grit and perseverance that helped them navigate early struggles and near-bankruptcy.,Pivoting from a failing recruitment agency (GroupTalent) to a sales engagement platform after discovering customers valued their internal sales tool.,"They found product-market fit by creating a tool that automated and optimized the outbound sales process, a major pain point for sales teams.","A subscription-based SaaS model with a land-and-expand strategy, starting with SMBs and moving upmarket.","A strong culture of ownership and winning as a team, which fostered a highly motivated and collaborative environment.","Raised $489M in total, achieving a $4.4B valuation, indicating strong investor confidence and growth.","They avoided the mistake of trying to build a product with too many features, instead focusing on a core set of features that solved a critical problem.",Don't be afraid to pivot your business if you discover a more valuable customer need. Listen to the market.,
Salesloft (Sales Engagement),Salesloft (Sales Engagement),2011,Acquired,$2.3B,"A relentless focus on customer success, with the CEO personally reading all customer feedback.",Building an integrated platform with a comprehensive suite of tools for sales engagement.,"A strong, intentionally-built company culture based on a clear set of core values.","Pivoted from an unprofitable product to focus on sales development, a critical move that aligned the company with a clear market need.",Achieved product-market fit by deeply listening to customer feedback and iterating on the product to meet their evolving needs.,Subscription-based SaaS model with a focus on moving upmarket to serve enterprise clients.,"A culture built on core values, leading to high employee satisfaction and external recognition.","Strategic funding rounds, including a significant personal investment from a board member, fueled growth.",Avoided getting stuck with an unprofitable product by making the tough decision to pivot early on.,"A strong, values-based culture is not just a 'nice-to-have' but a key driver of success and resilience, enabling teams to navigate challenges and excel.",
Apollo.io (Sales Intelligence),Apollo.io (Sales Intelligence),2015,Private Unicorn,$1.6B,Successful pivot to a product-led growth (PLG) strategy.,Freemium model and focus on an underserved SMB market segment.,"'Discovery SEO' growth hack, creating millions of data-rich landing pages.","Pivoted from a high-touch, sales-led motion to a freemium, product-led growth (PLG) model, targeting SMBs.","Focused on NPS and organic word-of-mouth, making the product a growth engine by solving user needs.","A freemium, self-serve model that led to cash-flow positivity and rapid ARR growth.","A data-driven culture of continuous, rapid iteration and experimentation (weekly A/B tests).","Achieved 9x revenue growth since 2021, raising $100M Series D at a $1.6B valuation.",Recovered from near-failure by abandoning an unprofitable sales-led model.,"Focus on an underserved market segment and build a product so good that it generates organic, word-of-mouth growth.",
ZoomInfo (B2B Data),ZoomInfo (B2B Data),2007,Public (IPO),$3.3B,"Data-driven go-to-market strategy, using AI to rank leads and personalize outreach.","Focused market segmentation, dominating a niche before expanding to other markets.",Strategic acquisitions to expand data offerings and market reach.,Bootstrapped with $25k from credit cards and focused on a niche market (mid-market IT companies) to gain early traction and fund growth.,"Iterative approach, building custom data profiles for early customers to fund product expansion and refine offerings based on direct feedback.",Subscription-based model with a focus on customer activation and upselling.,"A culture of resourcefulness and adaptability, starting with manual data gathering and evolving to AI-powered automation.","Initially bootstrapped, demonstrating high capital efficiency from the start.",Avoided the common mistake of targeting too broad a market from the beginning.,Dominate a niche market first before expanding. Use data to drive sales and marketing efforts. Iterate your product based on customer feedback.,
Clearbit (Data Enrichment),Clearbit (Data Enrichment),2015,Acquired,$150M,"API-first approach, providing data as a service to developers and businesses.","Product-led growth strategy, offering free tools to attract and convert customers.","Strong focus on data quality and accuracy, building a reputation for reliable data.","Prioritized profitability and sustainable growth, achieving profitability within nine months of their seed round.","Offered free tools to help startups identify their Total Addressable Market (TAM) and Ideal Customer Profile (ICP), then upsold them to a paid platform.",A freemium model that converted free users of their popular tools into paying customers for their data platform.,"Emphasis on 'Conscious Leadership,' a culture of feedback, and employee happiness, leading to low turnover.","Raised minimal funding, focusing on profitability and sustainable growth from the early days.","Avoided raising excessive venture capital early on, which allowed them to focus on building a sustainable business.",Focus on providing real value with free tools to build a strong user base and drive product-led growth.,
