Subject,Company Name,Founding Year,Current Status,Valuation/Exit Value,Key Success Factor 1,Key Success Factor 2,Key Success Factor 3,Critical Early Decision,Product-Market Fit Strategy,Revenue Strategy,Team/Culture Factor,Funding Efficiency,Mistake Avoided/Recovered,Lesson for SMEs,Error
6sense (ABM Platform),6sense (ABM Platform),2013,Private Unicorn,$5.2B,AI-powered predictive analytics to identify in-market buyers with high accuracy.,"Focus on providing actionable insights, not just data, to empower revenue teams.","Strong go-to-market strategy and team, complementing a robust technical foundation.","Pivoted from a 'black box' predictive score to a full platform that provided the 'why' behind the data, making it actionable for sales and marketing teams.","Achieved by building a user interface that contextualized the AI's predictions, allowing sales and marketing teams to trust and act on the insights provided.","SaaS subscription model, with a recent expansion into a freemium, product-led growth (PLG) motion.",Hired a strong go-to-market team to complement the existing data science and engineering talent.,"Raised $426M over 10 rounds, indicating a strategy of aggressive growth and market capture.",Recovered from early customer churn by listening to feedback and building a more intuitive and contextual user interface.,"Focus on making data understandable and actionable. Don't just show the 'what,' explain the 'why' to build trust and drive user adoption.",
Demandbase (ABM),Demandbase (ABM),2006,Private,$1.33B,"Pioneered Account-Based Marketing (ABM), establishing itself as a leader in the category.","Developed an integrated Go-to-Market (GTM) platform, unifying sales and marketing efforts.",Leverages AI to provide customers with actionable insights for smarter revenue growth.,"Shifted from lead-centric to account-centric marketing, focusing on the underserved needs of B2B marketers.","Achieved by developing a platform that directly addressed the challenge of B2B companies to efficiently identify, target, and engage their most valuable accounts.","A subscription-based SaaS model for its all-in-one platform, ensuring recurring revenue.",A strong emphasis on customer success and delivering measurable results.,Raised significant capital to fuel growth and strategically acquire complementary technologies.,Avoided being a niche player by transitioning from a point solution to a full-funnel GTM platform.,"Identify a specific, high-value problem within a niche market, dominate it, and then expand strategically through product development and acquisitions.",
Drift (Conversational Marketing),Drift (Conversational Marketing),2015,Acquired,$1B+,"Created and popularized the 'Conversational Marketing' category, establishing themselves as the leader.","Customer-centric approach, focusing on creating a more human and frictionless buying experience.","Product-led growth with a freemium model, allowing for wide adoption and effective upselling.","Pivoted from a mobile messaging app to a B2B conversational marketing platform, creating a new category.",Identified the need for real-time sales conversations and built a targeted solution for sales and marketing teams.,"SaaS subscription model with tiered pricing, supplemented by a freemium entry point.","A culture of transparency and customer-obsession, driven by experienced founders.","Raised over $100M to fuel rapid growth and category creation, leading to a successful acquisition.",Avoided building in a vacuum by continuously engaging with customers and iterating on their feedback.,Define and own a new market category to differentiate from competitors and build a strong brand.,
Qualified (Pipeline Generation),Qualified (Pipeline Generation),2018,Acquired,$1.5B,"Pioneered agentic AI marketing with their AI SDR, Piper, to automate pipeline generation.","Deep integration with the Salesforce ecosystem, founded by former Salesforce executives.",Strong product-market fit demonstrated by 400% YoY revenue growth and 150% net customer retention.,"Built by Salesforce veterans, for Salesforce customers, ensuring deep integration and alignment with the Salesforce ecosystem from day one.","Addressed the broken traditional marketing funnel with an AI agent providing 24/7 lead engagement, qualification, and meeting scheduling.",B2B SaaS model targeting enterprise customers with a focus on high-value accounts.,"Deep Salesforce DNA within the founding and leadership team, fostering a culture of ecosystem expertise.",Raised $163M in 4 rounds before a major acquisition by Salesforce.,Avoided direct competition with a market leader by building a complementary and integrated solution.,Deeply integrating with a major platform's ecosystem can be a powerful growth and exit strategy.,
Chili Piper (Scheduling),Chili Piper (Scheduling),2016,Private,$625M,Niche focus on inbound lead conversion for B2B sales teams.,Product-led growth strategy with a freemium model.,Strong remote-first and transparent company culture.,"Bootstrapped for several years, which enforced capital efficiency and a focus on building a sustainable business model from the start.","Solved the critical and painful problem of scheduling meetings with inbound leads, a major bottleneck for sales teams.","Subscription-based SaaS model with tiered pricing, focusing on upselling and cross-selling to existing customers.","A remote-first, transparent culture with a flat organizational structure that empowers employees.","Highly capital-efficient due to being bootstrapped initially, followed by strategic funding rounds to accelerate growth.","Avoided raising excessive venture capital too early, which allowed the founders to maintain control and focus on long-term value.","Focus on solving a very specific and painful problem for a niche audience and build a strong, intentional company culture from the beginning.",
Calendly (Scheduling),Calendly (Scheduling),2013,Private Unicorn,$3B,"Product-led growth (PLG) strategy with a freemium model, enabling wide adoption and viral marketing.",Viral marketing loop embedded in the product; every user invites others to use the product.,"Simplicity and user-friendliness of the product, solving a common pain point effectively.","Bootstrapped for years, focusing on profitability and sustainable growth before taking significant VC funding, which allowed them to maintain control.","Solved the universal scheduling problem with a simple, elegant solution. The freemium model drove wide adoption and viral spread, providing feedback for refinement.","Freemium SaaS model with tiered subscription plans for advanced features, converting a percentage of the large free user base to paid plans.","Remote-first company culture, enabling the company to attract top talent globally.",Highly capital efficient due to its product-led growth and early bootstrapping. Profitable before major funding.,Avoided the 'growth at all costs' mentality by focusing on sustainable growth and profitability from the start.,"Focus on solving a real problem with a simple, user-friendly solution. A product-led growth strategy with a freemium model can drive viral growth.",
Loom (Async Video),Loom (Async Video),2015,Acquired,$975M,"Product-led growth strategy with a freemium model, driving widespread adoption.",Obsessive focus on user feedback and continuous product iteration to improve user experience.,"Right timing with the shift to remote work, making async video communication essential.",Pivoted from a failed user-testing tool (Opentest) to a standalone video recording and sharing application.,"Repositioned to focus on asynchronous communication for remote teams, solving a major pain point.","Bottom-up adoption model, converting free individual users into paying enterprise customers.",A customer-obsessed culture where founders were directly involved in support and feedback.,"Raised over $200M from top VCs like Sequoia & Andreessen Horowitz, enabling rapid growth.",Did not persist with their initial failed product; pivoted quickly based on user feedback.,Be relentless in understanding user needs and be willing to pivot your product to find product-market fit.,
Vidyard (Video Platform),Vidyard (Video Platform),2011,Private,$300M,Freemium model to attract a wide user base and demonstrate value.,Focus on video analytics to provide actionable insights for sales and marketing teams.,Strong integration with major marketing automation and CRM platforms.,Pivoted from an enterprise-focused model to a product-led growth strategy with a freemium offering to attract a wider user base.,"Offered a free, easy-to-use video platform to compete with YouTube for business use, then upsold on advanced features and analytics.",Subscription-based model with tiered pricing based on features and usage.,Customer-centric approach with teams organized around customer segments to enhance focus and expertise.,"Raised approximately $91M in total, focusing on strategic investments to fuel growth and product development.",Avoided being solely a sales-led organization by embracing a product-led growth model for scalability.,Embrace a product-led growth strategy and a freemium model to build a large user base and demonstrate value before asking for payment.,
Wistia (Video Marketing),Wistia (Video Marketing),2006,Private,$17M,Exceptional content marketing that educates and builds a loyal audience.,Product-led growth driven by a freemium model that showcases value.,"A strong, customer-centric culture focused on support and relationships.","Pivoting from a filmmaking competition site to a business-oriented video hosting and analytics platform, which was crucial for finding a viable business model.",Focused on solving the specific video marketing needs of businesses with an easy-to-use platform and valuable analytics.,"A freemium model with tiered pricing for advanced features, storage, and branding.","A culture of transparency, collaboration, and continuous learning.","Highly capital-efficient, raising only $1.5M before buying out investors to regain control.","Resisted pressure to sell the company, opting to buy out investors and maintain their vision.",Build a sustainable business with a strong culture and long-term vision. Don't be afraid to take calculated risks to maintain control and pursue your mission.,
Vimeo (Video Platform),Vimeo (Video Platform),2004,Acquired,$1.38B,"Niche focus on creative professionals and businesses, differentiating from mass-market platforms.",Successful pivot from a B2C model to a B2B SaaS platform for video creation and marketing.,"All-in-one video solution, providing a comprehensive suite of tools for businesses.","Focused on high-definition video and a creator-centric community, rather than competing with YouTube on viral content.","Catered to filmmakers and creative professionals, then pivoted to a B2B SaaS model for businesses, offering a full suite of video tools.","Freemium SaaS model with tiered subscription plans, upselling users to paid plans with advanced features.","Strong leadership from CEO Anjali Sud, who orchestrated the successful pivot to a B2B-focused company.","Early acquisition by IAC provided stability and resources, followed by a successful IPO and acquisition.",Wisely abandoned a costly original content strategy to focus on their core strength: video tools.,Find a niche market and serve it exceptionally well. Be prepared to pivot your business model when a better opportunity arises.,
Hopin (Virtual Events),Hopin (Virtual Events),2019,Acquired,$7.8B,First-mover advantage in the virtual events market during the COVID-19 pandemic.,Product-led growth driven by a high-quality user experience and viral adoption.,"A hybrid event strategy that expanded the market by augmenting, not just replacing, physical events.","Launched the product early, even when not fully complete, to capitalize on the sudden market demand created by the pandemic.","Created a new category of event technology focused on interactive networking and community building, not just content delivery.","SaaS model for the all-in-one events platform, later supplemented by revenue from acquisitions like StreamYard.","A fully remote company from day one, with a culture of relentless execution and a strong founder vision.",Aggressive fundraising led to hyper-growth but also a crowded cap table and lack of investor governance.,"Recovered from over-reliance on a temporary trend by making savvy acquisitions, like StreamYard.",Solve a deeply personal pain point to create a product that resonates with a massive audience and focus on building a viral MVP.,
Bizzabo (Event Tech),Bizzabo (Event Tech),2011,Private,$200M,Rapid pivot to a virtual and hybrid event platform in response to the COVID-19 pandemic.,"Customer-centric approach, continuously iterating the product based on user feedback.",Data-driven platform that allows organizers to measure event success and ROI effectively.,"Expanded from a simple networking app to a comprehensive, all-in-one event management platform, addressing a broader market need.","Achieved by listening to customer needs and evolving from a networking app to a full-suite event management platform, finding the 'experience-market fit'.","SaaS subscription model, providing a recurring revenue stream from their event management platform.",Resilient and agile team culture that enabled a rapid and successful pivot during a crisis.,"Raised $194.5M in total, with a significant $138M Series E to dominate the hybrid event market.",Avoided shutting down during the pandemic by quickly pivoting to a virtual event model.,Embrace adaptability and be willing to reinvent your business model in response to market shifts. Listen to your customers to guide your evolution.,
Splash (Event Marketing),Splash (Event Marketing),2011,Acquired,Acquired by Cvent in 2024; the acquisition price was not publicly disclosed.,Easy-to-use platform that empowered marketers to create and manage events without technical expertise.,"Focus on repeatable events, a key need for field marketers to scale their event programs.",Strong emphasis on brand consistency with customizable templates and a brand asset library.,"Pivoted from a general event platform to focus on B2B event marketing for enterprise clients, a key strategic shift that led to their success.",Achieved product-market fit by catering to the needs of field marketers with an intuitive platform for creating and managing repeatable events.,"SaaS model with a focus on enterprise clients, providing a scalable and recurring revenue stream.",A strong founding team and a product-focused culture that led to a successful acquisition by Cvent.,"Raised a modest $14.7M in funding, indicating a lean and efficient use of capital before being acquired.","Avoided a direct, head-on competition with event giants by niching down to B2B event marketing.","Focus on a specific, underserved niche and provide a simple, user-friendly solution. This is more effective than competing with established players in a broad market.",
Eventbrite (Ticketing),Eventbrite (Ticketing),2006,Acquired,$500M,Extreme customer-centricity from the founding team.,Capital efficiency and focus on sustainable growth.,"Strong, mission-driven company culture with a focus on talent.","Focused on long-term, sustainable success and customer-centricity, with founders directly handling customer service.","Catered to a wide range of events, building strong relationships with early adopters in the tech community.","Tiered fee structure based on a percentage of ticket sales, offering different service levels.","A founder was dedicated to talent, building a people-centric and mission-driven culture.","Bootstrapped early on, raising capital from a position of strength rather than desperation.","Avoided over-reliance on venture capital, focusing on building a resilient business.","Prioritize building a sustainable, customer-focused business and a strong team culture over chasing venture capital.",
Toast (Restaurant Tech),Toast (Restaurant Tech),2012,Public (IPO),$20B,"All-in-one, cloud-based platform on open-source Android, offering both software and hardware.","Deep understanding of the restaurant industry, with many employees having prior experience.","Strategic focus on the middle of the country, avoiding the Silicon Valley echo chamber.","Pivoting from a consumer mobile payment app to a comprehensive, restaurant-focused POS system.",Started by solving a specific pain point (slow check-out) and expanded to a full suite of services based on customer feedback.,"SaaS model with recurring revenue from subscriptions, plus hardware sales and payment processing fees.","A 'scrappy,' hands-on culture with a strong emphasis on customer feedback and industry expertise.",Bootstrapped with mentor funding before achieving significant revenue and seeking institutional investment.,Avoided the 'hype over substance' mentality by focusing on building a solid product and business.,"Focus on solving a real customer pain point and build a strong, industry-focused culture. Prove your model before seeking large-scale funding.",
Square (Payments),Square (Payments),2009,Public (IPO),$40.87B,"Simple, transparent, and flat-fee pricing model that appealed to small businesses.",Focused on the underserved market of small and medium-sized businesses (SMBs).,"Built an ecosystem of services beyond payments, including payroll, lending, and analytics.","Created a simple mobile card reader, enabling small businesses to easily accept credit card payments, a previously complex and expensive process.","Addressed the unmet need for SMBs to accept credit cards with a simple, low-cost mobile reader and app, leading to rapid adoption.","Transaction fees, subscription services, and hardware sales, employing a 'razor and blade' model.",Strong founding team (Jack Dorsey and Jim McKelvey) with a focus on design and user experience.,Raised $520M in VC funding and secured strategic partnerships with Visa and Starbucks to fuel growth.,Recovered from service outages by investing in infrastructure and offline payment capabilities.,"Focus on solving a specific pain point for an underserved market with a simple, user-friendly solution, and then expand your offerings to create a sticky ecosystem.",
Clover (POS),Clover (Point of Sale),2010,Acquired,$56.1M,"Open platform with an app marketplace, allowing for customization and a wide range of functionalities.","Strategic acquisition by First Data, providing access to a large existing merchant base.","All-in-one hardware and software solution, offering a seamless and integrated experience for merchants.","Focused on an open, all-in-one POS platform with an app marketplace, not just a simple payment processor, to provide a comprehensive and customizable solution.",Targeted SMBs needing more than just payment processing by offering a full-featured POS with an app-based ecosystem for various business management needs.,Revenue from both hardware sales (Clover Station) and recurring SaaS subscriptions for software and apps.,"A culture of impact and competition, where employees are motivated by seeing the direct results of their work.","Raised a relatively small amount of funding before being acquired, indicating good capital efficiency.",Avoided being a simple payment dongle by creating a comprehensive and customizable POS platform.,"Partner with established industry players for distribution and market access. Build a platform, not just a product, to create a long-term competitive advantage.",
Lightspeed (Retail Tech),Lightspeed (Retail Tech),2005,Public (IPO),$1.6B,"Strategic acquisitions to expand product offerings and enter new markets (hospitality, e-commerce).",Early focus on a scalable SaaS business model with recurring subscription revenue.,"Emphasis on a strong, long-lasting founding team and a positive company culture.","Focused on providing a cloud-based POS system for small and medium-sized businesses, an underserved market at the time.","Started with retail POS, then expanded to hospitality and e-commerce through acquisitions, adapting to customer needs.","Subscription-based SaaS model, payment processing fees, and sales of premium add-on features.","A culture that values authenticity, employee well-being, and a long-tenured, cohesive leadership team.","Secured significant funding from prominent VCs, enabling strategic acquisitions and rapid growth.",Recovered from a 2016 data breach and adapted to market changes with strategic layoffs in 2023-24.,Build a scalable business from the start and be open to strategic acquisitions to accelerate growth and market penetration.,
Shopify POS (Retail),Shopify POS (Retail),2013,Public (IPO),$205B,"Unified commerce platform seamlessly integrating online and in-person sales, inventory, and customer data.","Simple, intuitive interface that is easy for merchants of all sizes to use and manage their business.","Scalable solution that caters to businesses of all sizes, from small pop-ups to large enterprises.","Launched a POS system to integrate online and offline retail, addressing a major pain point for merchants by unifying their operations.","Solved the problem of managing separate online and offline stores by providing a single, unified platform for inventory, sales, and customer data.",Subscription-based model for the platform and transaction-based fees for payment processing.,A strong focus on empowering entrepreneurs and merchants to succeed in the retail industry.,"Shopify has a strong cash position with no debt, indicating efficient use of capital.","Avoided the mistake of treating online and offline retail as separate channels, focusing on an integrated omnichannel experience.",Adopt an omnichannel strategy and use a unified platform to manage all aspects of the business for a seamless customer experience.,
Faire (Wholesale),Faire (Wholesale),2017,Private Unicorn,$5B,Created a two-sided marketplace connecting independent brands with local retailers.,Offered a 'try before you buy' model with net 60 terms and free returns.,Implemented a viral customer acquisition loop with the 'Faire Direct' referral program.,"Offered a 'try before you buy' model, giving retailers 60-day payment terms and free returns, which de-risked inventory purchasing.",Achieved product-market fit by addressing the inventory risk for small retailers through favorable payment terms and free returns.,"Commission-based model, charging brands a percentage of each sale made on the platform.","A leadership team willing to admit mistakes, pivot strategy, and make tough decisions like layoffs.",Shifted from a cash-burning growth model to a focus on sustainable growth and capital efficiency.,Recovered from a period of hyper-growth that led to decreased quality and poor customer service.,Prioritize sustainable growth over growth at all costs. Be transparent with customers and willing to admit and correct mistakes.,
Alibaba (B2B Marketplace),Alibaba (B2B Marketplace),1999,Public (IPO),$398.71B,"Unique business model focusing on small enterprises, creating a vast and diverse marketplace.","Unconventional profit model based on advertising and technical support, not transaction fees.",Reliable credit model with seller verification and escrow payment (Alipay) to build trust.,"Focused on the Chinese market with Taobao to outcompete eBay, and created Alipay to solve the online payment trust issue.","Offered a free-to-list platform to attract a large number of sellers, which in turn attracted a massive user base, creating a strong network effect.","Monetized the platform through advertising, keyword bidding, and data-driven technical services.","Strong, visionary leadership from Jack Ma and a culture of customer-centric innovation.","Secured a crucial $1B investment from Yahoo! in 2005, which fueled its early expansion and growth.","Avoided charging transaction fees, which allowed it to rapidly gain market share from competitors like eBay China.","Focus on building a strong ecosystem and providing value-added services to customers, rather than just focusing on transactions.",
Flexport (Logistics),Flexport (Logistics),2013,Private Unicorn,$8B,Digital-first approach in a traditional industry,Full-stack service offering for end-to-end logistics,Data aggregation providing supply chain visibility,"Secured conditional commitments from shippers to attract carriers, solving the cold-start problem.","Developed a software platform to digitize the fragmented, paper-based logistics industry, offering visibility and control.","Generates revenue from freight forwarding fees and a suite of value-added services like customs, insurance, and trade financing.","A culture of 'building the rocket ship while it's in flight,' prioritizing customer acquisition and then automating workflows.","Aggressive venture-backed growth, raising over $2.5B to scale rapidly and capture market share.","Learned from founder's previous venture to not rely on public data, instead building a platform with proprietary data and network effects.","Digitize traditional, fragmented industries by creating a unified software platform that provides transparency and efficiency for all stakeholders.",
