Subject,Company Name,Founding Year,Current Status,Valuation/Exit Value,Key Success Factor 1,Key Success Factor 2,Key Success Factor 3,Critical Early Decision,Product-Market Fit Strategy,Revenue Strategy,Team/Culture Factor,Funding Efficiency,Mistake Avoided/Recovered,Lesson for SMEs,Error
Stripe (Fintech),Stripe (Fintech),2010,Private Unicorn,$95B,"Developer-first focus, making payment integration seamless for builders.","Simple, transparent, and predictable transaction-based pricing model.","Product-led growth strategy, where the product itself drives user adoption.","Prioritizing developers as the core user base, creating a powerful and organic distribution channel that bypassed traditional sales models.","Offered a simple, elegant API that abstracted away the immense complexity of online payments, a major pain point for developers and small businesses.","A clear, pay-as-you-go model charging a small percentage and a fixed fee per transaction.","A culture of being ""obsessively user-focused"" and empowering employees to solve customer problems.","Strategic fundraising to fuel global expansion and product development, not just for user acquisition.","Avoided premature enterprise focus, instead capturing the long-tail market of developers and startups.",Solve a complex problem with a simple solution for a niche audience. An easy-to-use product with transparent pricing can create its own powerful growth engine.,
Shopify (E-commerce),Shopify (E-commerce),2006,Public (IPO),$214B,"Ease of use for merchants, enabling anyone to start an online store.","A rich app ecosystem and API, allowing for extensive customization and functionality.","Integrated payment processing with Shopify Payments, simplifying transactions.",Built their own e-commerce platform after being frustrated with existing options for their snowboard store.,"The founders first built the platform for their own online store, ensuring it met real-world needs.",A multi-tiered subscription model combined with transaction fees from Shopify Payments.,A founder-led company with a strong focus on product and engineering.,Raised venture capital strategically before a successful IPO in 2015.,"Not relying on a single sales channel by integrating with Amazon, social media, and POS systems.","Solve your own problem first, then productize the solution for a wider market.",
Zoom (SaaS),Zoom (SaaS),2011,Public (IPO),$25B,"Simplicity and ease of use, creating a frictionless user experience.",Freemium business model that drove widespread adoption and viral growth.,Scalable and reliable infrastructure that supported massive growth.,"Focused on building a reliable, easy-to-use video conferencing solution despite a saturated market, prioritizing user experience over feature bloat.","Achieved viral growth by offering a free, reliable product that 'just worked,' leading to strong word-of-mouth marketing and bottom-up adoption in organizations.",Converted free users to paid plans by offering advanced features for business and enterprise customers.,A strong culture focused on customer happiness and employee well-being.,"Strategic funding rounds, achieving profitability before its IPO.","Avoided feature bloat, focusing on perfecting the core video conferencing experience.","Prioritize solving a core customer problem with a simple, high-quality product. A frictionless user experience can be a powerful competitive advantage.",
Canva (Design Tech),Canva (Design Tech),2013,Private Unicorn,$26B,"A freemium model that makes design accessible to non-designers, fostering a large user base.","An intuitive, user-friendly drag-and-drop interface that simplifies the design process.","Building a strong community and network effect, with users sharing and promoting their creations.","Validated their idea with a niche product (Fusion Books) before launching Canva, minimizing risk and proving the business model.","Addressed the widespread frustration with complex design software by creating a simple, web-based alternative for non-designers.","A freemium model with paid tiers (Canva Pro, Canva for Enterprise) offering advanced features.","A culture of extreme persistence and resourcefulness, exemplified by the founders' early struggles.","Secured initial funding through persistence after over 100 rejections, matched by a government grant.","Avoided the common startup pitfall of building a complex, feature-rich product from the outset.","Start with a focused, niche market to validate your core idea and business model before attempting to scale to a broader audience.",
Slack (Enterprise SaaS),Slack (Enterprise SaaS),2013,Acquired,$27.7B,"Bottom-up adoption with a freemium model, making it easy for teams to try and adopt.",Obsessive focus on user experience and a 'wall of love' from early users.,"Integrations with other tools, making it a central hub for work.",Pivoting from a failed gaming venture (Glitch) to a communication tool for teams.,Launched a preview release to gather feedback and iterated relentlessly based on user needs.,Freemium model with paid plans for advanced features and larger teams.,"A culture of empathy and customer-centricity, driven by the founders' vision.","Raised $1.2B in VC funding before a direct listing, showing strong investor confidence.","Avoiding the 'enterprise sales' model early on, focusing on product-led growth.","Build a product people love, and they will become your best advocates.",
Airbnb (Marketplace),Airbnb (Marketplace),2008,Public (IPO),$85B,"Built a strong two-sided network effect, attracting both hosts and guests.",Professional photography of listings to build trust and increase bookings.,"Focused on unique travel experiences and community, not just lodging.","Selling election-themed cereals to bootstrap and gain initial PR; integrating with Craigslist to tap into a large, existing user base.","Targeted events with accommodation shortages and offered a more authentic, affordable alternative to hotels, validated by professional photography.","Commission-based model, charging fees to both guests and hosts on each transaction.",A design-led culture that prioritizes user experience and creative problem-solving.,"Initial bootstrapping with creative, non-traditional funding, followed by strategic VC rounds.",Avoided the mistake of only focusing on the online platform and not on the offline experience of users.,Focus on user experience and do things that don't scale initially to build a strong foundation and community.,
Dropbox (Cloud Storage),Dropbox (Cloud Storage),2007,Public (IPO),$7B,A successful freemium model with a viral referral program that fueled rapid user growth.,"A simple, user-friendly product that solved the common problem of file synchronization.","Cross-platform availability, making it accessible to a wide range of users across different devices.","A simple explainer video that went viral, demonstrating the product's value and driving massive initial user sign-ups.","Addressed the widespread need for easy file synchronization across multiple devices, validated by strong organic adoption of its freemium offering.",A freemium model that converts free users to paid subscribers for more storage and advanced features.,"An engineering-driven culture that prioritized product quality, simplicity, and user experience.",Secured early-stage funding from Y Combinator and later from top-tier VCs like Sequoia Capital.,Avoided feature bloat by focusing on a 'minimum viable product' and iterating based on user feedback.,"Focus on solving a single, painful problem for users and create a simple, elegant solution. A viral loop can be a powerful and cost-effective growth engine.",
HubSpot (Marketing Tech),HubSpot (Marketing Tech),2006,Public (IPO),$19.8B,"Inbound marketing methodology, attracting customers through valuable content and experiences.","Freemium business model, offering a free CRM to build a large user base and upsell premium hubs.","A strong, transparent company culture, codified in their ""Culture Code,"" attracting and retaining talent.","Pioneered inbound marketing, shifting focus from outbound tactics to attracting customers with valuable content and thought leadership.","Addressed small business needs with a free, easy-to-use CRM, then expanded with powerful, integrated marketing and sales tools.","Tiered subscription model for its various ""Hubs"" (Marketing, Sales, Service), catering to different business sizes.","Treating culture as a product, with a focus on transparency, autonomy, and employee growth (HEART).","Strategic VC funding followed by a successful IPO, fueling growth and key acquisitions.","Avoided being a niche tool by building a comprehensive, all-in-one platform for marketing, sales, and service.",Educate your market and provide value upfront. A strong content strategy can be a powerful and cost-effective customer acquisition channel.,
Atlassian (Dev Tools),Atlassian (Dev Tools),2002,Public (IPO),$36B,Product-led growth flywheel model.,"Self-service, low-friction sales model.",Focus on a strong company culture and values.,"Bootstrapped with a focus on product-led growth, avoiding a traditional sales force and relying on a self-service model.","Solved their own problem by building Jira, a bug-tracking tool, and then sold it to other developers.","Low-cost, high-volume sales through a self-service model and transparent pricing.",A culture of questioning conventions and encouraging first-principles thinking.,"Bootstrapped with $10,000 credit card debt, demonstrating high capital efficiency before raising venture capital.","Avoided building a large, expensive sales force early on, which allowed for more efficient scaling.","A self-service model and product-led growth can be a powerful, low-cost alternative to a traditional sales force.",
Mailchimp (Email Marketing),Mailchimp (Email Marketing),2001,Acquired,$12B,Freemium model that attracted a massive user base and created a powerful growth engine.,"A strong, playful brand identity that differentiated them in a crowded market.",Deeply understanding and catering to the needs of small businesses.,"Started as a side project, allowing for organic growth without the pressure of investor expectations.",Pivoted from a web design agency to an email marketing platform based on customer demand.,A freemium model with tiered pricing for users who needed more advanced features.,"A culture of humility, creativity, and independence, empowering employees.","Bootstrapped for 20 years, reinvesting profits for sustainable growth.","Avoiding venture capital, which prevented dilution and pressure for unsustainable growth.",Focus on a specific customer niche and build a product that serves their needs exceptionally well.,
Basecamp (Project Management),Basecamp (Project Management),1999,Private,$100B,"Focus on simplicity, creating intuitive software that solves a specific problem well.",Prioritizing sustainable profitability over hyper-growth and venture capital funding.,"Embracing a remote-first culture from the early days, enabling a global talent pool.","Pivoting from a web design consultancy to a product-based company, building a tool to solve their own project management challenges.","Created a tool for their own needs that addressed the pain points of other small businesses and freelancers, achieving organic product-market fit.","A simple, flat-fee subscription model (SaaS) that is profitable and easy for customers to understand.","A small, close-knit team with a strong emphasis on work-life balance, avoiding 'hustle culture'.","Primarily bootstrapped, with a single minority investment from Jeff Bezos, maintaining control.",Avoided the common startup trap of chasing venture capital and prioritizing growth at all costs.,"Build a profitable, sustainable business by creating a great product that solves a real problem, without relying on venture capital.",
GitHub (Developer Platform),GitHub (Developer Platform),2008,Acquired,$7.5B,First-mover advantage in the niche market of social coding.,Strong community-building efforts and powerful network effects.,A freemium business model that encouraged widespread adoption.,"Focusing on developers and their needs from day one, creating a platform that was easy to use and fostered collaboration.",Solved a critical pain point for developers: collaborating on code. The platform's ease of use and social features made it go viral.,Freemium model with paid plans for private repositories and enterprise features.,"Initially a flat organization, which fostered innovation and a high degree of employee autonomy.","Bootstrapped for the first four years, then raised strategic funding from top-tier VCs.","Avoided charging for open-source projects, which was key to its widespread adoption and success.",Build a strong community around your product and focus on solving a real problem for a specific niche.,
Figma (Design Collaboration),Figma (Design Collaboration),2012,Public (IPO),$56.3B,"Real-time collaboration in the browser, breaking down design silos.",A generous freemium model that fueled product-led growth and widespread adoption.,Building a strong community and ecosystem around the product with Figma Community.,"Pivoting from initial ideas like drone software to a web-based collaborative design tool, focusing on a specific market need.",A multi-year invite-only beta period allowed for deep user feedback and iterative product development before the public launch.,"A seat-based subscription model with tiered pricing for individuals, teams, and enterprises.",A culture of listening to users and building a product that designers love to use.,Strategic funding rounds from top-tier investors to fuel growth and product development.,"Successfully navigated the failed Adobe acquisition, maintaining independence and focus.",Focus on solving a deep user pain point with a product-led growth strategy and build a strong community to create a defensible moat.,
Notion (Productivity),Notion (Productivity),2013,Private Unicorn,$10B,"Community-led growth, empowering users to create and share templates and workflows.","All-in-one workspace, combining notes, tasks, wikis, and databases into a single platform.","Flexible, block-based architecture that allows users to build their own tools and workflows.","Pivoted from a failing no-code tool, moved to Kyoto, and rebuilt the product from scratch.","Achieved product-market fit by creating a flexible, all-in-one tool that users could adapt to their specific needs, fostering a sense of ownership.","Freemium model with paid tiers for teams and enterprises, driving wide adoption and upsell opportunities.","A culture of intense focus and dedication, exemplified by the founders' period of rebuilding in Kyoto.","Lean early years, then strategic funding rounds to fuel growth after achieving product-market fit.",Avoided clinging to a failing initial product by making the tough decision to pivot and rebuild.,Leverage community-led growth by empowering users to become advocates and co-creators.,
Airtable (Database),Airtable (Database),2012,Private Unicorn,$11B,Product-led growth model with a freemium and reverse-trial offering to drive user adoption.,Horizontally applicable product with user-generated templates that cater to vertical-specific needs.,Fostered a strong community and user-generated content through 'Airtable Universe'.,"Two-year private alpha with 100 customers to co-create the MVP, ensuring deep market alignment from day one.","Achieved through a bottom-up adoption model, allowing users to define use cases with templates and sharing.","Freemium model with a 'reverse trial' to encourage upgrades, and an enterprise sales team for larger clients.","Deeply customer-centric and data-driven, tracking user metrics to inform both product and sales.","Leveraged a product-led growth model to lower customer acquisition costs, complemented by substantial funding.",Avoided feature bloat by maintaining a customer-centric approach and co-developing the product with users.,Empower users to become your marketing engine by creating platforms for them to share their creations and use cases.,
Calendly (Scheduling),Calendly (Scheduling),2013,Private Unicorn,$3B,"Product-led growth (PLG) strategy, where the product itself drives user acquisition and retention.","Freemium model with a powerful viral loop, where new users are acquired through meeting invites.","Simple, intuitive user experience that solves a common pain point with an elegant solution.","Bootstrapped with minimal funding, focusing on product perfection before monetization, which allowed for organic growth and a strong user base.","Achieved product-market fit by creating a simple solution to the universal problem of scheduling, leading to strong organic adoption and word-of-mouth growth.","Tiered SaaS model with pricing based on features, encouraging users to upgrade for more functionality.",A customer-centric culture that prioritizes user feedback to continuously improve the product.,"Highly capital-efficient, reaching $70M ARR on just $550k seed funding before its Series B.","Avoided a usage-based pricing model, which would have penalized active users and hindered growth.","Focus on solving a single, painful problem exceptionally well, and leverage product-led growth to create a viral loop for sustainable, low-cost user acquisition.",
Typeform (Forms),Typeform (Forms),2012,Private Unicorn,$935M,"A user-centric design philosophy, creating beautiful, conversational, and engaging forms.",A powerful freemium model with a built-in viral loop through 'Made with Typeform' branding.,"Strong content marketing and community building, providing valuable templates and resources.","Focusing on a single product, the form, and perfecting its design and user experience to be more conversational and human-like, which set them apart.","Achieved by creating a 'more human' and engaging form experience that users enjoyed and shared, leading to strong organic growth and high completion rates.",A freemium model that converts free users to paid plans for advanced features and higher usage limits.,A remote-first company culture that emphasizes human connection and a people-centric approach.,"Strategic funding rounds, including a $135M Series C, to fuel growth and product development.","Avoiding the trap of creating boring, utilitarian forms, instead focusing on a niche and beautiful design.",Focus on solving a common problem in a delightful and user-centric way. A strong product experience can create a powerful viral marketing loop.,
Intercom (Customer Messaging),Intercom (Customer Messaging),2011,Private Unicorn,$1.3B,"Solving their own problem first, which deeply resonated with a core audience of B2B SaaS companies.","Identifying and focusing on a 'Minimum Viable Segment' to establish a strong, concentrated user base.","A relentless, 'customer-obsessed' culture driving continuous product improvement and user satisfaction.","Built a simple messaging app to solve their own internal communication challenges, which created a clear and relatable value proposition for other businesses.","Identified 'clusters of demand' and focused on a 'Minimum Viable Segment' (MVS), conducting extensive customer interviews to define three core use cases.","Began charging early, validating the product's value and establishing a sustainable business model.",A 'customer-obsessed' culture with a heavy emphasis on user research and product management.,"Raised $241M, achieving a $1.3B valuation, demonstrating strong capital efficiency.","Resisted the temptation to chase all potential customers, instead maintaining focus on their core MVS.",Identify a 'cluster of demand' and a 'Minimum Viable Segment' before scaling. Prioritize deep customer understanding and resist diluting your core product.,
Segment (Data Platform),Segment (Data Platform),2011,Acquired,$3.2B,"Solved a critical pain point for developers with a single, simple API.",Pivoted from a failed education tool to a B2B data platform.,Strong focus on customer feedback to guide product development.,"Open-sourcing their core analytics library, which built trust and a strong community.","Found PMF by accident after open-sourcing an internal tool, then built the company around it.",Tiered subscription model based on data volume and features.,Egoless learning and treating the business as an experiment.,"Raised significant funding after finding product-market fit, enabling rapid growth.","Didn't give up after initial product failures, but pivoted based on user needs.","Listen to your users, even if their needs are different from your original vision.",
Twilio (Communications API),Twilio (Communications API),2008,Public (IPO),$19B,"Developer-centric approach, making it easy for developers to integrate their APIs.","Usage-based pricing model, which lowered the barrier to entry and aligned with customer growth.",Strong focus on platform evangelism and building a community around their product.,"Focused on a developer-centric model, creating easy-to-use APIs that solved a real problem for a specific niche, rather than a broad enterprise solution.","Provided a simple, affordable solution for developers to integrate communications, a significant pain point, leading to rapid adoption and a strong developer community.","Usage-based pricing model, allowing customers to pay as they grow, which created a ""land and expand"" dynamic.","A ""by developers, for developers"" culture, with a strong emphasis on innovation and empowering developers.","Raised significant venture capital, but the usage-based pricing model also contributed to capital efficiency.","Avoided the mistake of building a complex, enterprise-focused product from the start.",Focus on solving a real problem for a specific niche and make your product as easy to use and adopt as possible. A usage-based pricing model can be a powerful tool for growth.,
Datadog (Monitoring),Datadog (Monitoring),2010,Public (IPO),$748M,"A unified, easy-to-use platform for infrastructure monitoring, APM, and log management.",A successful land-and-expand business model with a strong self-service motion.,"Right product at the right time, capitalizing on the shift to cloud-native architectures.","Building a unified platform to break down silos between developer and operations teams, anticipating the rise of DevOps and cloud computing.","Focused on the developer and operations teams, creating a tool that provided visibility across the entire stack and fostered collaboration.","SaaS subscription model with usage-based pricing, allowing customers to start small and scale.",A strong engineering-driven culture that prioritizes innovation and product excellence.,Early struggles to raise funds forced capital efficiency and a strong focus on customer needs.,Rejected a multi-billion dollar acquisition offer from Cisco to pursue an IPO and remain independent.,Focus on solving a critical pain point for a specific audience and build a product that is deeply loved by its users.,
Snowflake (Data Warehouse),Snowflake (Data Warehouse),2012,Public (IPO),$70.60B,Consumption-based pricing model that aligns with customer value and facilitates scalable growth.,"Cloud-neutral platform that runs on AWS, Azure, and GCP, avoiding vendor lock-in for customers.",A strong partner ecosystem that accelerates customer adoption and expands the platform's use cases.,"Building a cloud-native data warehouse from scratch, instead of adapting a legacy system for the cloud.",Achieved by offering a cloud-neutral data platform that abstracts away the complexity of the underlying cloud infrastructure.,A consumption-based revenue model where revenue grows as customers' data usage increases.,A high-performance culture that is customer-obsessed and encourages collaboration and innovation.,"Raised over $1.4B in VC funding before a successful $3.4B IPO, demonstrating strong investor confidence.","Avoided tying its platform to a single cloud provider, which broadened its market appeal significantly.",Align your business model with customer value. Snowflake's consumption pricing is a prime example of this.,
MongoDB (Database),MongoDB (Database),2007,Public (IPO),$10B,Developer-first approach with a flexible document model (JSON-like).,Open-source distribution model leading to widespread adoption.,Early pivot to focus solely on the database product.,Pivoting from a PaaS to a standalone database product after recognizing the database layer's value and facing competition from Google App Engine.,"Addressed the need for a scalable, flexible database for unstructured data, which traditional relational databases struggled with, especially for web and mobile apps.",Freemium model with a free Community Edition and a paid Enterprise version with advanced features.,"A culture of innovation, and employee well-being, fostering creativity and disruption.",Raised significant venture capital ($311M by 2017) to fuel growth and enterprise feature development.,"Avoided being tied to a rigid relational database model, which allowed them to cater to the growing demand for NoSQL databases.","Focus on solving a specific, painful problem for a niche audience (developers) and leverage a freemium model to drive adoption before monetizing.",
